{
  "id": "knowledge-update-item-sent",
  "description": "collections.update_item on a text item: PATCH with pinned, pin_rank and title, only the fields given, and its Idempotency-Key. (The mock answers this case from its scenario.)",
  "client": {
    "api_key": "dn_test_conformance"
  },
  "call": {
    "method": "collections.update_item",
    "args": {
      "collection_id": "col_3f6c1a9e0b2d4c7f8a1e5d9b2c4f6a80",
      "item_id": "itm_9a0b1c2d3e4f5a6b7c8d9e0f1a2b3c4d",
      "pinned": true,
      "pin_rank": 1,
      "title": "Claims policy 2026, revised"
    }
  },
  "mock": {
    "scenario": {
      "steps": [
        {
          "status": 202,
          "headers": {
            "content-type": "application/json"
          },
          "body": {
            "id": "itm_9a0b1c2d3e4f5a6b7c8d9e0f1a2b3c4d",
            "reference": "policy-2026",
            "label": null,
            "metadata": {},
            "created_at": "2026-10-20T11:00:00Z",
            "title": "Claims policy 2026",
            "format": "markdown",
            "pinned": true,
            "pin_rank": 1,
            "source": "article",
            "file": null,
            "status": "queued",
            "stage": null,
            "progress": null,
            "serving": "none",
            "error": null,
            "delayed": false,
            "warnings": [],
            "chunks": 0,
            "tokens": 0,
            "content_sha256": "8c1f1e6b2a7d4c3b9e0f5a6d7c8b9a0e1f2d3c4b5a6978e0d1c2b3a4f5e6d7c8",
            "version": 2,
            "queued_at": "2026-10-20T11:00:01Z",
            "ready_at": null
          }
        }
      ]
    }
  },
  "expect": {
    "request": {
      "method": "PATCH",
      "path": "/v1/collections/col_3f6c1a9e0b2d4c7f8a1e5d9b2c4f6a80/items/itm_9a0b1c2d3e4f5a6b7c8d9e0f1a2b3c4d",
      "body": {
        "pinned": true,
        "pin_rank": 1,
        "title": "Claims policy 2026, revised"
      },
      "headers": {
        "authorization": "Bearer dn_test_conformance"
      },
      "header_patterns": {
        "user-agent": "^decisionnode-(python|node|go|java|dotnet|ruby|php|rust)/[0-9A-Za-z.+_-]+$",
        "content-type": "^application/json(;.*)?$",
        "idempotency-key": "^[0-9a-fA-F]{8}-[0-9a-fA-F]{4}-4[0-9a-fA-F]{3}-[89abAB][0-9a-fA-F]{3}-[0-9a-fA-F]{12}$"
      }
    }
  }
}
