{
  "id": "choice-from-list-of-names",
  "description": "choice(instructions, [names]) sends each name with a null description.",
  "client": {
    "api_key": "dn_test_conformance"
  },
  "call": {
    "method": "decide",
    "args": {
      "state": "Paid 740 SEK at Nordic Rail.",
      "questions": {
        "currency": {
          "$choice": {
            "instructions": "Which currency?",
            "options": [
              "SEK",
              "NOK",
              "DKK",
              "EUR"
            ]
          }
        }
      }
    }
  },
  "expect": {
    "request": {
      "method": "POST",
      "path": "/v1/decide",
      "headers": {
        "authorization": "Bearer dn_test_conformance"
      },
      "header_patterns": {
        "user-agent": "^decisionnode-(python|node|go|java|dotnet|ruby|php|rust)/[0-9A-Za-z.+_-]+$",
        "content-type": "^application/json(;.*)?$"
      },
      "body": {
        "model": "decisionnode-moe",
        "state": "Paid 740 SEK at Nordic Rail.",
        "questions": {
          "currency": {
            "type": "choice",
            "instructions": "Which currency?",
            "criteria": {
              "SEK": null,
              "NOK": null,
              "DKK": null,
              "EUR": null
            }
          }
        }
      }
    }
  }
}
