{
  "id": "batch-cancel",
  "description": "batches.cancel(batch_id) sends POST /v1/batches/{id}/cancel with no body.",
  "client": {
    "api_key": "dn_test_conformance"
  },
  "mock": {
    "scenario": {
      "steps": [
        {
          "status": 200,
          "body": {
            "id": "batch_01J9ZB8Q3T",
            "state": "cancelled",
            "counters": {
              "requests": 3,
              "queued": 0,
              "in_progress": 0,
              "completed": 0,
              "failed": 0,
              "expired": 0,
              "cancelled": 3
            },
            "created_at": "2026-10-06T09:12:04Z",
            "finalized_at": null,
            "expires_at": null,
            "ended_at": null,
            "results_url": null,
            "results_expire_at": null,
            "price_factor": 0.5,
            "usage": {
              "input_tokens": 0,
              "output_tokens": 0
            },
            "error": null
          }
        }
      ]
    }
  },
  "call": {
    "method": "batches.cancel",
    "args": {
      "batch_id": "batch_01J9ZB8Q3T"
    }
  },
  "expect": {
    "request": {
      "method": "POST",
      "path": "/v1/batches/batch_01J9ZB8Q3T/cancel",
      "headers": {
        "authorization": "Bearer dn_test_conformance"
      },
      "header_patterns": {
        "user-agent": "^decisionnode-(python|node|go|java|dotnet|ruby|php|rust)/[0-9A-Za-z.+_-]+$"
      }
    }
  }
}
