{
  "id": "knowledge-list-items-q-sort-sent",
  "description": "collections.list_items with q and sort: each sent only when given, q percent-encoded (a space as %20), beside offset and limit. (The mock answers this case from its scenario.)",
  "client": {
    "api_key": "dn_test_conformance"
  },
  "call": {
    "method": "collections.list_items",
    "args": {
      "collection_id": "col_3f6c1a9e0b2d4c7f8a1e5d9b2c4f6a80",
      "limit": 10,
      "q": "claims policy",
      "sort": "title"
    }
  },
  "mock": {
    "scenario": {
      "steps": [
        {
          "status": 200,
          "headers": {
            "content-type": "application/json"
          },
          "body": {
            "items": [
              {
                "id": "itm_9a0b1c2d3e4f5a6b7c8d9e0f1a2b3c4d",
                "reference": "policy-2026",
                "label": null,
                "metadata": {},
                "created_at": "2026-10-20T11:00:00Z",
                "title": "Claims policy 2026",
                "format": "markdown",
                "pinned": false,
                "pin_rank": 0,
                "source": "article",
                "file": null,
                "status": "ready",
                "stage": null,
                "progress": null,
                "serving": "current",
                "error": null,
                "delayed": false,
                "warnings": [],
                "chunks": 2,
                "tokens": 18,
                "content_sha256": "8c1f1e6b2a7d4c3b9e0f5a6d7c8b9a0e1f2d3c4b5a6978e0d1c2b3a4f5e6d7c8",
                "version": 1,
                "queued_at": "2026-10-20T11:00:01Z",
                "ready_at": "2026-10-20T11:00:09Z"
              }
            ],
            "offset": 0,
            "limit": 10,
            "total": 3,
            "total_capped": false,
            "next_offset": 1,
            "q": "claims policy",
            "sort": "title",
            "reference": null,
            "reference_prefix": null
          }
        }
      ]
    }
  },
  "expect": {
    "request": {
      "method": "GET",
      "path": "/v1/collections/col_3f6c1a9e0b2d4c7f8a1e5d9b2c4f6a80/items",
      "query": {
        "limit": "10",
        "q": "claims policy",
        "sort": "title"
      },
      "headers": {
        "authorization": "Bearer dn_test_conformance"
      },
      "header_patterns": {
        "user-agent": "^decisionnode-(python|node|go|java|dotnet|ruby|php|rust)/[0-9A-Za-z.+_-]+$"
      }
    }
  }
}
